{
  "schema_version": 1,
  "dataset_id": "a1_pronunciation_ownership",
  "version": 1,
  "inputs": [
    {
      "path": "data/reviewed/pronunciation-progression-strands-v1.json",
      "sha256": "2f060773421312ca67f1f54067e032757f188f212109874b32296461a191be3c"
    },
    {
      "path": "data/reviewed/a1-reconciliation-worklist-v1.json",
      "sha256": "b61e6d565003c5cee170db8c3660f9b96159894e39f928fe4fd71cd7075ae983"
    },
    {
      "path": "data/reviewed/a1-lexical-chunk-ownership-v1.json",
      "sha256": "35601d0831d7c2c0dd069a9cf6b5dc4e64c89b6ef9a840154475ea232dbdd4eb"
    }
  ],
  "policy": {
    "goal": "Maximise intelligibility, accurate key-detail transfer, listening recognition, and successful repair; never remove an accent.",
    "reference_model": "General American broad IPA supports consistent course models and SSML authoring but is not an imitation target.",
    "variation": "Accept stable intelligible English varieties and learner pronunciations when the intended word, contrast, and interaction remain clear.",
    "risk_use": "Arabic-learner risks are dialect-sensitive hypotheses requiring observation; they are not facts about an individual learner."
  },
  "targets": [
    {
      "target_id": "a1_pronunciation.spelling_sound_verification",
      "strand_id": "pronunciation.sound_perception",
      "title": "Letter names and spelling-sound verification",
      "control_status": "receptive_and_productive",
      "feature_or_contrast": "Recognise the English letter name and check a heard model or IPA for irregular high-value spellings rather than applying one fixed letter-sound rule.",
      "course_examples": [
        {
          "text": "A",
          "reference_ipa": "/eɪ/"
        },
        {
          "text": "E",
          "reference_ipa": "/iː/"
        },
        {
          "text": "I",
          "reference_ipa": "/aɪ/"
        },
        {
          "text": "G",
          "reference_ipa": "/dʒiː/"
        },
        {
          "text": "J",
          "reference_ipa": "/dʒeɪ/"
        },
        {
          "text": "name",
          "reference_ipa": "/neɪm/"
        },
        {
          "text": "phone",
          "reference_ipa": "/foʊn/"
        },
        {
          "text": "eight",
          "reference_ipa": "/eɪt/"
        },
        {
          "text": "one",
          "reference_ipa": "/wʌn/"
        }
      ],
      "meaning_risk": "A spelling-driven guess can make a name, digit, or key word unrecognisable.",
      "introduction_location": "lesson_candidate.understand_spoken_contact_details",
      "recycle_locations": [
        "lesson_candidate.exchange_personal_details_orally",
        "lesson_candidate.check_in_at_a_hotel"
      ],
      "mastery_evidence": "Hear a fresh key word, select its matching written form, then repeat or spell it when misunderstood.",
      "arabic_risk_hypothesis_ids": [
        "arabic_pronunciation.spelling_driven_pronunciation"
      ],
      "not_yet": "No full phonics or spelling-to-sound system is promised at A1.",
      "teaching_reference": "General American broad IPA for modelling only",
      "assessment_tolerance": "Accept any stable intelligible variety; require repair only when the target distinction or key detail is lost.",
      "source_refs": [
        "cefr.cv2020.p135.a1.overall_phonological_control.001",
        "cefr.cv2020.p135.a1.sound_articulation.001",
        "cefr.cv2020.p135.a1.sound_articulation.002"
      ],
      "level_expectation": "Distinguish selected high-value sounds, word boundaries, names, numbers, and learnt chunks in very clear speech.",
      "review": {
        "status": "accepted_for_a1_reconciliation",
        "reviewer": "codex_primary_curriculum_agent",
        "reviewed_at": "2026-08-10T15:28:00+03:00"
      }
    },
    {
      "target_id": "a1_pronunciation.name_number_segmentation",
      "strand_id": "pronunciation.sound_perception",
      "title": "Segment names, numbers, and key details",
      "control_status": "receptive_and_productive",
      "feature_or_contrast": "Hear word boundaries and grouping in very clear names, phone digits, dates, times, prices, and learnt chunks.",
      "course_examples": [
        {
          "text": "phone number",
          "reference_ipa": "/ˈfoʊn ˌnʌmbɚ/"
        },
        {
          "text": "zero",
          "reference_ipa": "/ˈzɪroʊ/"
        },
        {
          "text": "oh",
          "reference_ipa": "/oʊ/"
        },
        {
          "text": "fifteen",
          "reference_ipa": "/ˌfɪfˈtiːn/"
        },
        {
          "text": "fifty",
          "reference_ipa": "/ˈfɪfti/"
        }
      ],
      "meaning_risk": "A boundary or grouping error changes the recorded identity, time, or amount.",
      "introduction_location": "lesson_candidate.understand_spoken_contact_details",
      "recycle_locations": [
        "lesson_candidate.locate_names_places_and_times_in_slow_recordings",
        "lesson_candidate.identify_spoken_time_and_date_details",
        "lesson_candidate.relay_names_numbers_and_prices_from_slow_speech"
      ],
      "mastery_evidence": "Record a fresh slowly spoken name plus digit sequence, then confirm the grouping accurately.",
      "arabic_risk_hypothesis_ids": [],
      "not_yet": "Fast unscripted segmentation and unfamiliar proper names remain later or repair-supported.",
      "teaching_reference": "General American broad IPA for modelling only",
      "assessment_tolerance": "Accept any stable intelligible variety; require repair only when the target distinction or key detail is lost.",
      "source_refs": [
        "cefr.cv2020.p135.a1.overall_phonological_control.001",
        "cefr.cv2020.p135.a1.sound_articulation.001",
        "cefr.cv2020.p135.a1.sound_articulation.002"
      ],
      "level_expectation": "Distinguish selected high-value sounds, word boundaries, names, numbers, and learnt chunks in very clear speech.",
      "review": {
        "status": "accepted_for_a1_reconciliation",
        "reviewer": "codex_primary_curriculum_agent",
        "reviewed_at": "2026-08-10T15:28:00+03:00"
      }
    },
    {
      "target_id": "a1_pronunciation.p_b_contrast",
      "strand_id": "pronunciation.consonant_clarity",
      "title": "/p/ and /b/",
      "control_status": "receptive_and_productive",
      "feature_or_contrast": "Keep voiceless /p/ and voiced /b/ distinct in selected practical words.",
      "course_examples": [
        {
          "text": "pen",
          "reference_ipa": "/pɛn/"
        },
        {
          "text": "please",
          "reference_ipa": "/pliːz/"
        },
        {
          "text": "bag",
          "reference_ipa": "/bæɡ/"
        },
        {
          "text": "bus",
          "reference_ipa": "/bʌs/"
        }
      ],
      "meaning_risk": "A merger can change the requested item, place, or key noun.",
      "introduction_location": "lesson_candidate.ask_for_and_give_an_everyday_item",
      "recycle_locations": [
        "lesson_candidate.buy_a_basic_public_transport_ticket",
        "lesson_candidate.ask_for_basic_food_or_drink"
      ],
      "mastery_evidence": "Choose and say the intended fresh /p/- or /b/-initial word so a listener selects the correct item.",
      "arabic_risk_hypothesis_ids": [
        "arabic_pronunciation.p_b_contrast"
      ],
      "not_yet": "Do not drill the contrast if the learner already distinguishes it reliably.",
      "teaching_reference": "General American broad IPA for modelling only",
      "assessment_tolerance": "Accept any stable intelligible variety; require repair only when the target distinction or key detail is lost.",
      "source_refs": [
        "cefr.cv2020.p135.a1.overall_phonological_control.001",
        "cefr.cv2020.p135.a1.sound_articulation.001",
        "cefr.cv2020.p135.a1.sound_articulation.002"
      ],
      "level_expectation": "Produce selected high-impact consonant contrasts clearly enough in names, numbers, key nouns, verbs, and chunks.",
      "review": {
        "status": "accepted_for_a1_reconciliation",
        "reviewer": "codex_primary_curriculum_agent",
        "reviewed_at": "2026-08-10T15:28:00+03:00"
      }
    },
    {
      "target_id": "a1_pronunciation.f_v_contrast",
      "strand_id": "pronunciation.consonant_clarity",
      "title": "/f/ and /v/",
      "control_status": "receptive_and_productive",
      "feature_or_contrast": "Keep /f/ and /v/ distinct in family, number, and high-utility description words.",
      "course_examples": [
        {
          "text": "five",
          "reference_ipa": "/faɪv/"
        },
        {
          "text": "family",
          "reference_ipa": "/ˈfæməli/"
        },
        {
          "text": "very",
          "reference_ipa": "/ˈvɛri/"
        },
        {
          "text": "seven",
          "reference_ipa": "/ˈsɛvən/"
        }
      ],
      "meaning_risk": "A merger can obscure a number, family word, or intensified description.",
      "introduction_location": "lesson_candidate.understand_talk_about_people_and_family",
      "recycle_locations": [
        "lesson_candidate.exchange_information_about_family_and_friends",
        "lesson_candidate.identify_spoken_time_and_date_details",
        "lesson_candidate.describe_a_family_or_known_person"
      ],
      "mastery_evidence": "Discriminate and produce the intended fresh number or family word in an information gap.",
      "arabic_risk_hypothesis_ids": [
        "arabic_pronunciation.v_f_contrast"
      ],
      "not_yet": "Do not assume the issue from the learner's Arabic dialect or identity.",
      "teaching_reference": "General American broad IPA for modelling only",
      "assessment_tolerance": "Accept any stable intelligible variety; require repair only when the target distinction or key detail is lost.",
      "source_refs": [
        "cefr.cv2020.p135.a1.overall_phonological_control.001",
        "cefr.cv2020.p135.a1.sound_articulation.001",